,text_common
2423,bwhartland The team available 08001510900 247 absolute best answer quickly pxe2x80xa6 httpstcoXK2UypeU6s
2424,bwhartland Wendy experiencing high call volumes also consider health staxe2x80xa6 httpstcopXzRWYfVDQ
2425,bGraps1995 Graps Sorry wait We extremely busy moment Is anything help Nicola
2426,brobjgale think could financially impacted Covid19 youxe2x80x99ll find helpful advice money worrixe2x80xa6 httpstcoKPN0A1ddDe
2427,brobjgale Hello Rob payment holidays Barclaycard payments arenxe2x80x99t something wexe2x80x99re looking currently woxe2x80xa6 httpstcoYWF49kRHzN
2428,bsenorfrog82 Hey Will hear For methods pay Barclaycard bill pxe2x80xa6 httpstcokARDEUjKzX
2429,bKuduCapital The character count higher look explore things Ross 22 httpstcomPqb4etrYV
2430,bKuduCapital Kudo late reply wait time experienced We experiencing high call vxe2x80xa6 httpstcoBou9Kj2IRy
2431,bWrenBlack Hey Erin weve super busy across channels Did manage get thxe2x80xa6 httpstcooz0JIkICq2
2432,bTheRealJoJoC Hey Jo know itxe2x80x99s since messaged wexe2x80x99re havenxe2x80x99t heard uxe2x80xa6 httpstcovde63FK1s7
2433,bRokincow Hello LeeAnn teams busy supporting customers know difficult wait forxe2x80xa6 httpstcoNIijMB34tk
2434,bCheriScrumpts Geri reply really wait speak Have youxe2x80xa6 httpstcopHa25T0hEL
2435,bstem_maths response We reissue cards early identified issuesxe2x80xa6 httpstcoFqXVlPRzvp
2436,bscots_saboteur Hello want help Was booking made Barclaycard Ramona
2437,bnotmewhome Sorry confusion Were offering set payment holiday urgent financial supxe2x80xa6 httpstcodQCUrlUPcb
2438,bJohnJoeMulherin John reply really wait speak Have yxe2x80xa6 httpstcovY7Wtgxnwp
2439,bGemma290982 think could financially impacted Covid19 youxe2x80x99ll find helpful advice money woxe2x80xa6 httpstco7CWYRkApQ7
2440,bGemma290982 Payment holidays Barclaycard payments arenxe2x80x99t something wexe2x80x99re looking currently wonxe2x80x99t cxe2x80xa6 httpstcoHQxOTqaLWl
2441,bGemma290982 Hello Gemma know period must difficult 13
2442,bcheeno64 feel way totally appreciate difficult time take look webxe2x80xa6 httpstcoxSsve7srbJ
2443,bIf something goes wrong purchase paid Barclaycard could get money back nnThe eaxe2x80xa6 httpstcoFMQu465tZT
2444,btashaj4de Hey Tasha huge apologies long wait busy imagine appreciate patxe2x80xa6 httpstconH2dLcS2K9
2445,bJamieMcgauley However want make aware definitely long wait get membxe2x80xa6 httpstco0bvGblYF4k
2446,bJamieMcgauley Hey Jamie come bit shock reason weve dxe2x80xa6 httpstcoY5dZC3C0Vl
2447,bkay_jade9 Can let know help point right direction Amiee
2448,barot_03 Andi use Barclays app set contactless payments Android device To youxe2x80xa6 httpstcoA9Lm4cFrj9
2449,bholz_webster Hollie Ive seen youve come via Ill get back soon Paul
2450,blkg107 Hello experiencing high level calls moment might create delays withxe2x80xa6 httpstcoHyHA5tJBs1
2451,bShaneTasker88 Hello Shane thank reaching want help How site blocked enterxe2x80xa6 httpstcohnZ7Qeya6M
2452,bJonathanosa think could financially impacted Covid19 youxe2x80x99ll find helpful advice money woxe2x80xa6 httpstcoHcMBQt6Jn2
2453,bJonathanosa Hello payment holidays Barclaycard payments arenxe2x80x99t something wexe2x80x99re looking currently butxe2x80xa6 httpstcoJBa085AsGt
2454,bTasbir52239692 Tasbir feel way Our stance still moment txe2x80xa6 httpstco7ArMFwTEQ6
2455,bdanrich100 think could financially impacted Covid19youxe2x80x99ll find helpful advice money worrxe2x80xa6 httpstcol72VhrPxde
2456,bdanrich100 Hello Dan payment holidays Barclaycard payments arenxe2x80x99t something wexe2x80x99re looking currently wexe2x80xa6 httpstco5TbxWvLwsU
2457,bstevefergie Sorry Steve never intention understand upsetting worrying time manxe2x80xa6 httpstcodLAU76B3SV
2458,bgull500 think could financially impacted Covid19 youxe2x80x99ll find helpful advice money worriexe2x80xa6 httpstcovxepZjIZAE
2459,bgull500 Hello Gull payment holidays Barclaycard payments arenxe2x80x99t something wexe2x80x99re looking currently woxe2x80xa6 httpstcoxuOIDgA8nn
2460,bEkofalls47 Ah wonderful Charlie appreciate hold times havent ideal glad could helpxe2x80xa6 httpstcoWUsEseTLbi
2461,bSoupDragon0 Heres link website explains thishttpstcoLUQ1lu04QK Cody 22
2462,bSoupDragon0 Hey delayed reply busy imagine thanks hangingxe2x80xa6 httpstco7LcMOfqkKD
2463,bshannonsymes truly Shannon super busy across channels lately manaxe2x80xa6 httpstcoEZ2BcGEGGc
2464,bLisaJayneDowson Some teams working reduced capacity moment Barclays App team isntxe2x80xa6 httpstcoFUQ5Sd42Kq
2465,bLisaJayneDowson Lisa youve app Our Barclays Barclaycard apps contxe2x80xa6 httpstconSDnmt2uhO
2466,bkay_jade9 getting back Kay weve super busy across channels Justxe2x80xa6 httpstcoMLiC5nwZvR
2467,bSalvoBarrile We wouldnt charge late payment fees period We still recommend make yourxe2x80xa6 httpstcoD0z8mjO3RZ
2468,bkarlhba reply really wait speak Have manaxe2x80xa6 httpstcoXMxARtqFnO
2469,baKahnR Ali hear youve impacted totally appreciate worryingxe2x80xa6 httpstcoEYNMyvh8m9
2470,bandrewdavis_ai Morning Andrew Sorry getting back You cant use Credit Card pay billxe2x80xa6 httpstcoXrWrAYUYSZ
2471,bLettie44 Lettie This looks like standard email totally appreciate hasnt come best tixe2x80xa6 httpstco5mkYOxxVZG
2472,bjohngriffiths1 really Have fraud team touch could let knoxe2x80xa6 httpstcoim5Ny0ZkRV
2473,brd11x R Can tell little whats happened Please feel free Nicola httpstcomPqb4etrYV
2474,bAnaVK youre problems generally managing money youxe2x80x99ll find helpful advice money woxe2x80xa6 httpstcoWjQNJRQRYr
2475,bAnaVK think could financially impacted Covid19 call 0800 046 8324 find canxe2x80xa6 httpstco3UTML7Jprb
2476,bAnaVK hear We wonxe2x80x99t charging late payment cash advance fees 19xe2x80xa6 httpstcoFavaDBLl8S
2477,bChefWayner Ah really wait Weve released info helping herexe2x80xa6 httpstcokJHhugU2AU
2478,bLOUBSKLOU Hey Lou youre getting cut long hold What would like speak Andy
2479,bmelvynbignall Melvyn We fewer colleagues usual answering phones right thexe2x80xa6 httpstcoQgKFB2peqB
2480,bady_threlfall really really busy moment Were aware happening somexe2x80xa6 httpstcog55quU5Rhj
2481,bdavis0688 Allan really wait speak Can needed discuss maxe2x80xa6 httpstconfrVbeIS8g
2482,bQuantumWrites You arrange make direct transfer bank account httpstco7BaQYa7GdZ Kristos 22
2483,bQuantumWrites Mart Ixe2x80x99m hear seem difficulties accessing systems moxe2x80xa6 httpstcoQvIdGybXUB
2484,bL4UR3_N Youre welcome Just give shout help anything else Rach
2485,bshazerstan Feel free pop info one youre looking chat Id happy try help Rach 22
2486,bshazerstan Sharon global situation busier usual We also take considerationxe2x80xa6 httpstco634AZom5fD
2487,bburdett_trevor Hey Trevor Id like try help May ask sent everything Also advised wouldxe2x80xa6 httpstcoLd8qATzaUS
2488,bBoogieDave arent implementing payment holidays However wonxe2x80x99t charging late payment caxe2x80xa6 httpstco33UdbUo3nZ
2489,bnickychurchill Hey Nicky getting back busy imagine butxe2x80xa6 httpstcokzwlLhdbGx
2490,b_al_hunter Al Direct Debit due Monday well started request mid week would bexe2x80xa6 httpstcoSZlHnTqyVD
2491,bnjg_03 Nicholas varies depending kind claim youre making Check link infoxe2x80xa6 httpstcoTaKL6XozhD
2492,bLE_Beauregard Hey Leslie thanks message appreciate isnt ideal imagine bxe2x80xa6 httpstcoYzksFEtTOJ
2493,bpineappletree50 call team Wayne explain talk options longer term thexe2x80xa6 httpstcodEGArvZipU
2494,bFabbiha5 marco_ferrero_ take look link information thatxe2x80xa6 httpstcoM4t2SauJ3U
2495,bshannonblessing Shannon team respond quickly able afraid timescales arent bexe2x80xa6 httpstco3bNMKe4nWm
2496,bJWGordon63 Hey Jesse getting back busy imagine thanxe2x80xa6 httpstconHPZiZwJWL
2497,bJoannaLSimpson 22 Due current situation experiencing higher call queues usual moment sxe2x80xa6 httpstcoHPTSGtNSOF
2498,bJoannaLSimpson Jo get credit balance transferred back bank account would nexe2x80xa6 httpstco67dvFcska1
2499,bDMU_Cammerz patience Cameron Only seen already speaking Nikki
2500,bbillyj511 Hey Billy youre trouble making payment Whats happening able get sorted Cody
2501,bDemps1 Karen afraid dont account access call queues excessive right Do axe2x80xa6 httpstcow8yoPrfRva
2502,bgadboislensnola Karen UK team AskBarclaysUS team youd speak youd like anyxe2x80xa6 httpstco3dDRprReR2
2503,bbigredwool In terms making payment page sort code account number use alongxe2x80xa6 httpstcohLXIRZUoKo
2504,bbigredwool In order get account unlocked speak phone able accesxe2x80xa6 httpstcoUt5fB5Vcdi
2505,bDarloMurphy John thats happening youre able way print form andxe2x80xa6 httpstco3lWVBo9NF3
2506,bDanLOsborne Dan limited help dont account access feel free Thanksxe2x80xa6 httpstcoiyWS4oWyQU
2507,btedee_de sure thats working either Dee Do online banking current account Nikki
2508,balisonsawyer We appreciate may frustrating colleagues working try help many peoplexe2x80xa6 httpstcouHuhzj8IbC
2509,balisonsawyer To help support urgent wexe2x80x99d ask check information firxe2x80xa6 httpstcoQTZl07HaIj
2510,bNMorbs Neil The reason difficulties due Covid19 outbreak We rexe2x80xa6 httpstcoDyBv6QskfL
2511,balisonsawyer We fewer colleagues usual answering phones right coronavirus outbreaxe2x80xa6 httpstcoJH0eK609ox
2512,bfranco_vernava Hey thanks message getting wexe2x80x99ve lot busier thaxe2x80xa6 httpstcoLPmeGHMCGN
2513,bemlouise_87 Emma wait It depends circumstances wed still urge keep payxe2x80xa6 httpstcoEEeFcmNzbn
2514,bheatheratchison Heather trying operate best much less staff higher cxe2x80xa6 httpstcoVtESOyApe8
2515,biamAsh_LFC We wonxe2x80x99t charging late payment cash advance fees 19 March 17 June 2020 xe2x80x93 wexe2x80x99ll taxe2x80xa6 httpstcod2iT5sO4d3
2516,bpchana Pritpal really could let know youre looking Ill check oxe2x80xa6 httpstcoAsxHnjmWo1
2517,bArk17th guide best Barclays bank account Feel free pop DMxe2x80xa6 httpstcoMVW5HIdHiX
2518,bMeatsRupert youve financially impacted COVID19 call 0800 046 8324 every day 9am 9pmxe2x80xa6 httpstcopTyaIoNPkm
2519,bMeatsRupert Hey Rupert Sorry hold getting back Were offering payment breaks creditxe2x80xa6 httpstcoqgOrSrnTeM
2520,bsheztipple youre problems generally managing money youxe2x80x99ll find helpful advice monxe2x80xa6 httpstcoCj8ODysHUp
2521,bsheztipple think could financially impacted Covid19 call 0800 046 8324 find wexe2x80xa6 httpstcoLx1VQ45nKB
2522,bsheztipple Hey really reply We wonxe2x80x99t charging late payment cash advance fees bexe2x80xa6 httpstcoEKeK4XN6r7
2523,bMikeDenaro1 Hey Mikey see replied sent previously December furthxe2x80xa6 httpstco8syJzVHcyN
2524,bshazel_chy youre problems generally managing money youxe2x80x99ll find helpful advice monxe2x80xa6 httpstco6OeYEvgTcd
2525,bshazel_chy think could financially impacted Covid19 call 0800 046 8324 find wexe2x80xa6 httpstcof5bryNycnT
2526,bshazel_chy Hey Shazel late reply We wonxe2x80x99t charging late payment cash advance fees betweexe2x80xa6 httpstcoRRZbVjqev0
2527,bjakjaks long wait busier normal moment Did manage speak witxe2x80xa6 httpstcodP4ETWSb2D
2528,b4now2day2morrow apologies No means wont charged late payment cash adxe2x80xa6 httpstcoVgTaYCfTVQ
2529,bpbakewel Yes Paul advisors answering calls As imagine dealing lot queriexe2x80xa6 httpstcoO12mX4KVUb
2530,bC0tt0n1 Mark appreciate frustration team working quickly As sxe2x80xa6 httpstcouNhBseE7Kn
2531,bgatelab What youre needing complete Claire Feel free youd prefer Sarah
2532,bJohnFTiranno Citi BankofAmerica John AskBarclaysUS best placed answer US queries Were UK team Nikki
2533,bByBeccaGliddon Which number calling wanting online account Youre welcome txe2x80xa6 httpstco8sySg5SRit
2534,bmartanimate really werent able get Did get sorted Nikki
2535,bByBeccaGliddon Becca wait We dont email address able use helpxe2x80xa6 httpstcoJAEhCMJQ4P
2536,bytrnalpessimst late reply confirm wouldnt able arrange refund via sexe2x80xa6 httpstco0OOcfO8zvb
2537,bBeckyTizzard Okay team 247 little easier Sarah
2538,bvalentinaiannec Valentina team ignoring lots customers deal wxe2x80xa6 httpstcop6kSTkZiAX
2539,bdobiemanengland So Colin Our team 0800 151 0900 would able help please bexe2x80xa6 httpstcoOB8raSvPqW
2540,bbrenn8001 Howard happened get touch Customer Service give infxe2x80xa6 httpstcoYAQVprbGjc
2541,bluke_batch Luke manage get anyone Apologies replying Nikki
2542,bBeckyTizzard really hold time The team high demand moment We would speakxe2x80xa6 httpstco0OV56AWM2y
2543,bbblace youre set DD extra payments reduce theyre made make requesxe2x80xa6 httpstcoiu8IVb0V4v
2544,bkt_btlr Katie Ive able send Can Nikki httpstcomPqb4etrYV
2545,bkt_btlr Katie Ill Nikki
2546,bhuwdai We dont afraid Huw Sorry delayed reply help generic queries youd like mxe2x80xa6 httpstcownLip4QOyw
2547,bb31avfc really youve able get Were unable service number rigxe2x80xa6 httpstco5bTFktoUw6
2548,bdavekoor think could financially impacted Covid19 call 08000468324 Theyre open every daxe2x80xa6 httpstcoiUMkHL9cXl
2549,bdavekoor Dave hear youve affected recent events nWe wonxe2x80x99t charging late pxe2x80xa6 httpstcovRqZX9JDCO
2550,bBeckyTizzard Becky thanks patient We dont communicate email afraid secure Haxe2x80xa6 httpstco4PSPmreqbJ
2551,bCanxe2x80x99t find Barclaycard You let know block quickly using Barclaycard app For informatixe2x80xa6 httpstcoRT9BPA6EB3
2552,bjlc0732 Ah John wed never ignore purpose see Nikki got back yesterday eveninxe2x80xa6 httpstco9QJMTbteqo
2553,bJohnPMckinlay Hey John hear line cut Have managed get yet notxe2x80xa6 httpstcorSe72I1j60
2554,bSakarie94 Sakarie due current situation taking time get dealing lxe2x80xa6 httpstcoqgpQqR5FLh
2555,bpaulr___ That number service Paul really youve many problems want pop toxe2x80xa6 httpstcoeKZCoqjIsL
2556,bMissVerity Verity youd like bit information mean Nikki
2557,blloydengland Hey Lloyd thanks message getting wexe2x80x99ve lot busierxe2x80xa6 httpstcoQIcOqiMi8B
2558,bMichelleJC06 Hello Michelle let know youre looking please Id like see help nChristie
2559,bantony_jazzy Antony thanks patient waiting reply You contact get refxe2x80xa6 httpstcoiKcrKvmxvO
2560,blrdw1 Qantas Hey pop let know Qantas said Also could give lxe2x80xa6 httpstcoM3WnlZ4rg9
2561,bflourpower28 Hello Emma requested refund company instead voucher nIf needxe2x80xa6 httpstcokwMtviVYmm
2562,bbigredwool Hey thanks message getting wexe2x80x99ve lot busier usxe2x80xa6 httpstco1GX61JJBIX
2563,bJustElliotMG Not sure whats happened Elliot rather ask call sort moment knxe2x80xa6 httpstcoKiydW0pzKJ
2564,bLauren_brabin1 Hey Lauren thanks message getting wexe2x80x99ve lot busxe2x80xa6 httpstco6sCx32yq4Q
2565,bMicheley1101 Ah great wexe2x80x99re 247 anything else Have amazing day thanks time Brogan
2566,bExpected2Fly Ive dropped Brendan
2567,bloochyloo Lucy thanks tweet waiting reply Could please try clear browser Cacxe2x80xa6 httpstcou3rGByKcMg
2568,bclaire_dibs Claire look would mean calling You reach 0xe2x80xa6 httpstcoeElK2o9FWk
2569,bchunkythefruit Christopher thanks much patience waiting reply Its greatly appreciated Coxe2x80xa6 httpstco292aiqaBmi
2570,blapseofsanity Mark certainly look help Can log account online send usxe2x80xa6 httpstcohfBisb2Ngm
2571,bMicheley1101 Michele error messages getting Feel free pop soxe2x80xa6 httpstcoMnFmhqlNO5
2572,bTheOnlyElChazmo Sorry seeing high volumes contact To help support urgent needxe2x80xa6 httpstcoCOqjkcCO2w
2573,bgingegem22 Gemma hear wed check secure channel give txe2x80xa6 httpstco5Cr8cwrfMg
2574,bDyer8Craig Craig constantly looking ways help keeping website updated advice infoxe2x80xa6 httpstcoPbxyuRikz2
2575,bnomenwisdom Emma thanks patience waiting reply Its greatly appreciated Can tell whatxe2x80xa6 httpstcomMNulepUZq
2576,bHannah45092498 Hey Hannah hear Can possibly send screenshot Dean httpstcomPqb4etrYV
2577,bMichaelC_Openun Sorry hear Mike log account online send Secure Messxe2x80xa6 httpstcoeVH2P5GzWU
2578,btimborichens You call team directly 08001615291 7am 11pm printing posting form Ross 22
2579,btimborichens Hello Timbo late reply Due current events operating reduced staff whixe2x80xa6 httpstco3RX600TsT3
2580,bGreenGeordie9 We assessing situation time please keep checking web page updates txe2x80xa6 httpstco3LbuldXXoI
2581,belvistheterrier Elizabeth late reply Unfortunately isnt email option Here wxe2x80xa6 httpstcoIyoQOVSkQq
2582,bstevefergie Hey Steve send table number try buy pint On serious note staff onxe2x80xa6 httpstcopDvJ4e8PTr
2583,bGaryWardbiz understand issue fraud managed freeze card You mention yourxe2x80xa6 httpstcoEPA4Q6pU3B
2584,bGaryWardbiz Gary hear waiting get exceptionally bxe2x80xa6 httpstcoDfi2S8WwxC
2585,bCABooth Ah happy days glad done trick Give shout anything else Take care stay safe Cathy Cody
2586,bNicolasouth Sorry hear delivery slot please let know issue persists sites yxe2x80xa6 httpstcoh9Vb6NY9Vx
2587,byaaaas_queen Lou see youve come via Ill get back shortly Rach
2588,bbolger_c Hey long wait Due Coronavirus fewer colleagues phones canxe2x80xa6 httpstcofcioJCXGJK
2589,bJm90John Brilliant glad hear sorted Please dont hesitate give shout theres anything elxe2x80xa6 httpstcoukwBum0HvY
2590,bJim_RL James please send talk little detail Leigh httpstcomPqb4etrYV
2591,bFeeBeFIT Thats odd Do app try Nikki
2592,bMarkSharon_DP Wexe2x80x99ll apply Base Rate change interest rates day statement message notifyingxe2x80xa6 httpstcoODvL45SZHn
2593,brappers2012 John youve able get As imagine seeing high amounts ofxe2x80xa6 httpstcoD2k4XhsM1r
2594,bJm90John Sorry youre problems John Has rectified Nikki
2595,bfouronesixtwo Joe weve removed option Has transaction query billed accountxe2x80xa6 httpstcoV6VcyGIZZU
2596,bMrWeg Ole Barclaycard UK To speak team Germany please use following link contact detaixe2x80xa6 httpstco9gpyYASoBu
2597,bmalahidem So issues getting Have managed speak team yet Nikki
2598,bMatthewJGibson Matthew cash fees youre using ATM A Money Transfer offer notxe2x80xa6 httpstco7KWHBQWV54
2599,bamolnarkar Amol Things busy right help though try best Nikki
2600,bphilhardaway Phil dealy replying Check link advice httpstcodnD2PEvsi6 Nikki
2601,bRobinprint Robin replying Due current situation receiving higher thaxe2x80xa6 httpstcozxSIf9KnZ7
2602,bDJ_JimmyK Your interest fees still remain line account Jimmy Your minimum payment provixe2x80xa6 httpstcoKXYC2F3y7V
2603,bviewfromN5 youxe2x80x99ve able speak someone already thatxe2x80x99s great still help pleaxe2x80xa6 httpstcogeoqJfbERi
2604,bviewfromN5 know itxe2x80x99s since messaged wexe2x80x99re havenxe2x80x99t heard uxe2x80xa6 httpstco1hMOpwSeZz
2605,bBoldGalStrong Lisa UK team AskBarclaysUS may able help query thoughxe2x80xa6 httpstcomSC6Q3r8T6
2606,bL4UR3_N refunds put account credit yes send bank Nikki
2607,brichstone59 So Richard Ill pick Nikki
2608,bEkofalls47 Charlie youre trouble Is anything help Paul
2609,bAAUBlog So holding Rebecca Were currently looking many ways improve sxe2x80xa6 httpstco5tdHSk8eCz
2610,blconlan91 Lesley replying Were working around clock answer messages Yxe2x80xa6 httpstco8j1QZiDe8g
2611,b_lee_barnard Lee really youve credit limit decrease youd like discuss feelxe2x80xa6 httpstcobvxN2zo0ux
2612,bL4UR3_N Lauren check link help httpstcodnD2PEvsi6 Nikki
2613,bCrystalHenley Sarah youre struggling moment Check link information mxe2x80xa6 httpstcoGHK55sQk3P
2614,bNicolasouth Donxe2x80x99t worry clear cache cookies browser try go forxe2x80xa6 httpstcoevorw6GoWw
2615,bNicolasouth Nicola apologise payments werenxe2x80x99t working know wexe2x80x99ve intermittent problems withxe2x80xa6 httpstco29prmOskq8
2616,bCABooth Please dont worry clear cache cookies browser pop itxe2x80xa6 httpstcodFrQVukYxH
2617,bCABooth Cathy happened Wexe2x80x99ve made aware problem customers making paymentxe2x80xa6 httpstcool1Qwih9Ua
2618,blucyvh_x Lucy really happened details calling Ill see fxe2x80xa6 httpstcolybEXqFXRt
2619,bkimz1 dont deal Barclays Partner Finance head page informationxe2x80xa6 httpstco3DVqsi4hFp
2620,brishi_bhopal We able confirm security reasons hold times havexe2x80xa6 httpstcoIp5sqU1BIt
2621,balexg017 Hello Alex wont let online website option ring team onxe2x80xa6 httpstcop32eAja4ck
2622,bforster_p Donxe2x80x99t worry try clearing cache cookies popping payment shxe2x80xa6 httpstcoSbsltyehlt
2623,bforster_p Peter youve trouble making payment We aware issues making paymentsxe2x80xa6 httpstcoqUNJBwvCV8
2624,bTasbir52239692 Please check update Tasbir httpstcoiWvLWd93ASnIf think could financiallyxe2x80xa6 httpstcoE3TqkFH1HB
2625,bWe put clocks forward Sunday 29 March systems 000 GMT 300 Bxe2x80xa6 httpstcoeQqG3dDoWl
2626,bMinaWillment Mina youre problems right check linkxe2x80xa6 httpstcoonSKm8zDtp
2627,bKeelyAnna_ Keels Id recommend allowing 5 working days receive response dont hear thenxe2x80xa6 httpstcorN7FhNXvYi
2628,bericarens3 HSBC_UK HalifaxBank tescobankhelp Eric still working quickly physicalxe2x80xa6 httpstcomR5X3y7iDn
2629,bat0ne_ AmexUK really assure intentional way Were working hardesxe2x80xa6 httpstcoxpnDNdYj3U
2630,btedee_de Dee able access banks online banking youre able send payment overxe2x80xa6 httpstcoIWo7vK7gWu
2631,bRath0X Rath find base rates affect account link httpstco7mvkPspwyv Nikki
2632,bgriffange022 You Ange would done one advisors phone afraid notxe2x80xa6 httpstcoM4EAoDriSD
2633,bhurnie Hey Craig come Ill see help Nikki httpstcomPqb4etrYV
2634,bBratchT apologies wait come advise Illxe2x80xa6 httpstcoEA94gRg3ws
2635,biamAsh_LFC Ashley holding Did manage get sorted Nikki httpstcomPqb4etrYV
2636,blexstubbs Alexandra holding long hope managed get sorted pop DMxe2x80xa6 httpstco2jh1oKP5cX
2637,bTomGoalie Tom youre issue youd like come let know werexe2x80xa6 httpstcoHdPSi8mycv
2638,bBethjawn Beth due corona virus experiencing high call volumes well impact cxe2x80xa6 httpstcoqsjSCd9Lwe
2639,bNrth_Lts_Lashes Apologies Elizabeth got sorted please help Also Ixe2x80xa6 httpstco4gw4VyabRH
2640,bStay aware suspicious emails texts calls websites advertising fake coronavirus tests fraudsters pretxe2x80xa6 httpstcoATGK786Z4n
2641,bsilestanix much lovely message apologies long wait Did manage finish thatxe2x80xa6 httpstcorFQPtBFEgb
2642,bnotmewhome We wonxe2x80x99t charging late payment cash advance fees 19 March 17 June 2020 xe2x80x93 wexe2x80x99ll taxe2x80xa6 httpstcoQtBEJAVV1q
2643,bStephiesstar89 Stephanie due current situation working hard get messxe2x80xa6 httpstcoBvvQCxHkAG
2644,badkent Tony Id like understand around whats happening dont want stuck anywhere nnPxe2x80xa6 httpstcoaJUEChWdSw
2645,biamAsh_LFC unable access accounts afraid would unable make note account Wxe2x80xa6 httpstcojizJUdMuQ1
2646,b1995Fletch Thats great hear Toby Did transactions get refunded days Thats whatxe2x80xa6 httpstco38aFqR1ebf
2647,biamAsh_LFC really hear circumstances Ashely Due ongoing Coronavirus outbreak andxe2x80xa6 httpstcotOot9g9u9P
2648,bgatelab So replying Claire Did manage get sorted Nikki
2649,biamAsh_LFC Hello Ashley team exceptionally busy asking customers call essentiaxe2x80xa6 httpstcoOtjlQjruGS
2650,bvalentinaiannec hands Executive Office help Valentina Nikki
2651,bJoSage14 Jo youve reply still sorted please Nikki httpstcomPqb4etrYV
2652,bKingsleyIroning help would let know youre wanting discuss usxe2x80xa6 httpstcowO00voz9G0
2653,bRokincow LeeAnn really appreciate patience Estimates difficult theyre higher thisxe2x80xa6 httpstcomdVNjVVBFe
2654,bDJ_JimmyK Although wonxe2x80x99t charging late payment cash advance fees 19 March 17 June 2020 wxe2x80xa6 httpstcof0DpBVEyBc
2655,bmullan_martin Hey Martin arent able arrange call backs unfortunately pop letxe2x80xa6 httpstcoKmrKKDwjLR
2656,bDJ_JimmyK Jimmy apologies getting back getting lot messages momentxe2x80xa6 httpstcozOFvKkP65C
2657,bangiestirlo understand really hard time people moment especially youre self employed Wxe2x80xa6 httpstcobU8oCcnMay
2658,bracork Sorry hear ask log account online Lisa
2659,bGregoBecks Hey Greg really late reply aware issues service triedxe2x80xa6 httpstcopioJKmSWd4
2660,bangiestirlo Experian_UK long wait receiving calls messages havingxe2x80xa6 httpstcoULD5yloxsY
2661,bmulvoman wait busier usual moment Are still able log intoxe2x80xa6 httpstcooF8y5pyhZo
2662,bkay_jade9 Hello certainly understand waiting long frustrating manage speakxe2x80xa6 httpstcoDngN7VJzuL
2663,bjohngriffiths1 Hello John hear youve issues trying connect transaction didxe2x80xa6 httpstcoTE6J1IvXL0
2664,bRosannaPalmer Rosanna really wait speak Can reason call anxe2x80xa6 httpstcoiheqbzJjDl
2665,bTariiroAudreyy Hello Drey facing high levels calls moment manage speak someone Ramona
2666,bmichaelcsavage Michael We fewer colleagues usual answering phones right coroxe2x80xa6 httpstcos2aZpBWwMo
2667,bYork360 interest rates unaffected continue accrue charged This specifxe2x80xa6 httpstcoq5XQnwuLAk
2668,bshannonsymes Shan We fewer colleagues usual answering phones right coronavirxe2x80xa6 httpstco4Dx9fVhgfi
2669,brishi_bhopal Hello Rishi late reply We able confirm account specific information herexe2x80xa6 httpstco385sJuOBrD
2670,bKee_Mill Sorry reply Ive responded Kev
2671,bChefWayner apologies getting though wexe2x80x99ve busy trying help many customers wexe2x80xa6 httpstcomSp7QRHBke
2672,bStuInAus Stuart Id like check options Could answers following questions How didxe2x80xa6 httpstcoYQ8qWAE4ab
2673,bitsonlyandy Won alternative must another coffee dont like Contactless Mobile Itll definixe2x80xa6 httpstcoV8OgHF4NXj
2674,bpineappletree50 Wayne wouldnt want feeling like Weve set number different things toxe2x80xa6 httpstcoXMjMWU2RfX
2675,bitsonlyandy Andrew thanks getting touch We dont support alternative Ill txe2x80xa6 httpstcowmfnFdAqzx
2676,bpaulr___ appreciate frustration Paul Which ever way contact moment likxe2x80xa6 httpstcoEVmREGFVEB
2677,bbikerbabe108sc1 could pop help We larger characterxe2x80xa6 httpstcokGDfS6WKQy
2678,bPritpalGill Did pay least minimum amount bill Kristos
